{
  "spec_version": "ch.v0.1",
  "decisions": [
    { "title": "Emit full artifact bodies in structured block", "rationale": "Artifacts are authoritative; don't truncate on push" }
  ],
  "artifacts": [
    {
      "kind": "code",
      "name": "search_router",
      "language": "python",
      "body": "from __future__ import annotations\n\nimport logging\nfrom dataclasses import dataclass\nfrom typing import Sequence\n\nfrom sqlalchemy.ext.asyncio import AsyncSession\nfrom sqlalchemy import select, func, text\n\nfrom contexthub.models import Push, Summary, SummaryEmbedding\nfrom contexthub.providers import EmbeddingProvider\n\nlog = logging.getLogger(__name__)\n\n\n@dataclass(slots=True)\nclass SearchResult:\n    push_id: str\n    commit_message: str\n    score: float\n    workspace_id: str\n\n\nclass SearchRouter:\n    def __init__(self, session: AsyncSession, embedder: EmbeddingProvider):\n        self._session = session\n        self._embedder = embedder\n\n    async def hybrid(self, query: str, workspace_id: str, limit: int = 20) -> Sequence[SearchResult]:\n        vector = await self._embedder.embed(query)\n        vector_hits = await self._vector_lookup(vector, workspace_id, limit)\n        bm25_hits = await self._bm25_lookup(query, workspace_id, limit)\n        merged = self._reciprocal_rank_fusion(vector_hits, bm25_hits)\n        return merged[:limit]\n\n    async def _vector_lookup(self, vector, workspace_id, limit):\n        stmt = (\n            select(\n                Push.id.label('push_id'),\n                Push.commit_message,\n                Push.workspace_id,\n                (1 - SummaryEmbedding.embedding.cosine_distance(vector)).label('score'),\n            )\n            .join(Summary, Summary.push_id == Push.id)\n            .join(SummaryEmbedding, SummaryEmbedding.summary_id == Summary.id)\n            .where(Push.workspace_id == workspace_id, Push.deleted_at.is_(None))\n            .order_by(SummaryEmbedding.embedding.cosine_distance(vector))\n            .limit(limit)\n        )\n        rows = (await self._session.execute(stmt)).all()\n        return [SearchResult(str(r.push_id), r.commit_message, float(r.score), str(r.workspace_id)) for r in rows]\n\n    async def _bm25_lookup(self, query, workspace_id, limit):\n        ts_query = func.websearch_to_tsquery('english', query)\n        stmt = (\n            select(\n                Push.id.label('push_id'),\n                Push.commit_message,\n                Push.workspace_id,\n                func.ts_rank(Summary.content_tsv, ts_query).label('score'),\n            )\n            .join(Summary, Summary.push_id == Push.id)\n            .where(\n                Push.workspace_id == workspace_id,\n                Push.deleted_at.is_(None),\n                Summary.content_tsv.op('@@')(ts_query),\n            )\n            .order_by(text('score DESC'))\n            .limit(limit)\n        )\n        rows = (await self._session.execute(stmt)).all()\n        return [SearchResult(str(r.push_id), r.commit_message, float(r.score), str(r.workspace_id)) for r in rows]\n\n    @staticmethod\n    def _reciprocal_rank_fusion(a, b, k=60):\n        scores: dict[str, SearchResult] = {}\n        for rank, hit in enumerate(a):\n            scores[hit.push_id] = SearchResult(hit.push_id, hit.commit_message, 1 / (k + rank + 1), hit.workspace_id)\n        for rank, hit in enumerate(b):\n            if hit.push_id in scores:\n                existing = scores[hit.push_id]\n                scores[hit.push_id] = SearchResult(hit.push_id, hit.commit_message, existing.score + 1 / (k + rank + 1), hit.workspace_id)\n            else:\n                scores[hit.push_id] = SearchResult(hit.push_id, hit.commit_message, 1 / (k + rank + 1), hit.workspace_id)\n        return sorted(scores.values(), key=lambda r: r.score, reverse=True)\n"
    }
  ],
  "open_questions": [],
  "assumptions": [],
  "constraints": []
}
